b5dfa300 714319313 C Bi:1:003:1 0 72 = 20244200 7e04ffff ffffffff 0024d478 4f258100 a0640806 00010800 06040001
b5dfa300 714319377 S Bi:1:003:1 -115 2560 <
b3542480 714592066 S Ci:1:003:0 s c0 a1 0000 0114 0004 4 <
b3542480 714592206 C Ci:1:003:0 0 4 = 40080000
b3542480 714592238 S Co:1:003:0 s 40 a0 0000 0114 0004 4 = 41080000
b3542480 714592330 C Co:1:003:0 0 4 >
b3542480 714592355 S Ci:1:003:0 s c0 a1 0000 0114 0004 4 <
b3542480 714592445 C Ci:1:003:0 0 4 = 40080000
b3542480 714592470 S Ci:1:003:0 s c0 a1 0000 0118 0004 4 <
b3542480 714592557 C Ci:1:003:0 0 4 = 2d780000
b5dfaf00 715179049 C Bi:1:003:1 0 72 = 20244200 4458ffff ffffffff c4576ec1 bd2d0806 00010800 06040001 c4576ec1
b5dfaf00 715179090 S Bi:1:003:1 -115 2560 <
b5dfa180 716349695 C Bi:1:003:1 0 98 = 20245c00 0458ffff ffffffff e0b55fef 5fc90800 45000048 fb290000 4011fd0e
b5dfa180 716349732 S Bi:1:003:1 -115 2560 <
b5dfa800 716407817 C Bi:1:003:1 0 93 = 20245700 7d4dffff ffffffff c4576ec1 bd2d0800 45000043 00004000 4011b7ba
b5dfa800 716407849 S Bi:1:003:1 -115 2560 <
b3542480 716608062 S Ci:1:003:0 s c0 a1 0000 0114 0004 4 <
b3542480 716608171 C Ci:1:003:0 0 4 = 40080000
b3542480 716608202 S Co:1:003:0 s 40 a0 0000 0114 0004 4 = 41080000
b3542480 716608291 C Co:1:003:0 0 4 >
b3542480 716608315 S Ci:1:003:0 s c0 a1 0000 0114 0004 4 <
b3542480 716608407 C Ci:1:003:0 0 4 = 40080000
b3542480 716608431 S Ci:1:003:0 s c0 a1 0000 0118 0004 4 <
b3542480 716608531 C Ci:1:003:0 0 4 = 2d780000
b5dfab80 717637193 C Bi:1:003:1 0 72 = 20244200 cf33ffff ffffffff c4576ec1 bd2d0806 00010800 06040001 c4576ec1
b5dfab80 717637229 S Bi:1:003:1 -115 2560 <
b5dfa000 717940018 C Bi:1:003:1 0 72 = 20244200 0458ffff ffffffff 0024d478 4f250806 00010800 06040001 0024d478
b5dfa000 717940050 S Bi:1:003:1 -115 2560 <
b5dfa700 718184177 C Bi:1:003:1 0 86 = 20005000 0458b827 eb2db38e 0024d478 4f250800 4500003c 44454000 2706b32a
b5dfa700 718184204 S Bi:1:003:1 -115 2560 <
b3542280 718624071 S Ci:1:003:0 s c0 a1 0000 0114 0004 4 <
b3542280 718624192 C Ci:1:003:0 0 4 = 40080000
b3542280 718624224 S Co:1:003:0 s 40 a0 0000 0114 0004 4 = 41080000
b3542280 718624340 C Co:1:003:0 0 4 >
b3542280 718624367 S Ci:1:003:0 s c0 a1 0000 0114 0004 4 <
b3542280 718624467 C Ci:1:003:0 0 4 = 40080000
b3542280 718624493 S Ci:1:003:0 s c0 a1 0000 0118 0004 4 <
b3542280 718624592 C Ci:1:003:0 0 4 = 2d780000
b5dfa580 718949731 C Bi:1:003:1 0 72 = 20244200 a384ffff ffffffff 0024d478 4f250806 00010800 06040001 0024d478
b5dfa580 718949761 S Bi:1:003:1 -115 2560 <
b5dfa200 719181896 C Bi:1:003:1 0 86 = 20005000 0458b827 eb2db38e 0024d478 4f250800 4500003c 44464000 2706b329
b5dfa200 719181920 S Bi:1:003:1 -115 2560 <
b3402400 719989754 C Bi:1:003:1 0 72 = 20244200 a384ffff ffffffff 0024d478 4f250806 00010800 06040001 0024d478
b3402400 719989793 S Bi:1:003:1 -115 2560 <
b3402780 720094510 C Bi:1:003:1 0 72 = 20244200 0458ffff ffffffff c4576ec1 bd2d0806 00010800 06040001 c4576ec1
b3402780 720094537 S Bi:1:003:1 -115 2560 <
b3402600 720214843 C Bi:1:003:1 0 72 = 20244200 0458ffff ffffffff c4576ec1 bd2d0806 00010800 06040001 c4576ec1
b3402600 720214869 S Bi:1:003:1 -115 2560 <
b3402480 720509981 C Bi:1:003:1 0 114 = 20006c00 0458b827 eb2db38e e0b55fef 5fc90800 45480058 00004000 4006b883
b3402480 720510007 S Bi:1:003:1 -115 2560 <
