b5dfaf80 214157749 C Bi:1:003:1 0 72 = 20004200 7e04b827 eb2db38e 0024d478 4f250806 00010800 06040001 0024d478
b5dfaf80 214157811 S Bi:1:003:1 -115 2560 <
b4c76480 214157932 S Bo:1:003:2 -115 50 = 2a300000 2a000000 0024d478 4f25b827 eb2db38e 08060001 08000604 0002b827
b4c76480 214157987 C Bo:1:003:2 0 50 >
b5dfa300 214328464 C Bi:1:003:1 0 72 = 20244200 0440ffff ffffffff 0024d478 4f258100 a0640806 00010800 06040001
b5dfa300 214328500 S Bi:1:003:1 -115 2560 <
b4cb8f80 214624071 S Ci:1:003:0 s c0 a1 0000 0114 0004 4 <
b4cb8f80 214624196 C Ci:1:003:0 0 4 = 40080000
b4cb8f80 214624230 S Co:1:003:0 s 40 a0 0000 0114 0004 4 = 41080000
b4cb8f80 214624320 C Co:1:003:0 0 4 >
b4cb8f80 214624346 S Ci:1:003:0 s c0 a1 0000 0114 0004 4 <
b4cb8f80 214624437 C Ci:1:003:0 0 4 = 40080000
b4cb8f80 214624461 S Ci:1:003:0 s c0 a1 0000 0118 0004 4 <
b4cb8f80 214624550 C Ci:1:003:0 0 4 = 2d780000
b5dfaf00 215294775 C Bi:1:003:1 0 72 = 20244200 4458ffff ffffffff c4576ec1 bd2d0806 00010800 06040001 c4576ec1
b5dfaf00 215294805 S Bi:1:003:1 -115 2560 <
b5dfa180 215367742 C Bi:1:003:1 0 72 = 20244200 0458ffff ffffffff 0024d478 4f258100 a0640806 00010800 06040001
b5dfa180 215367771 S Bi:1:003:1 -115 2560 <
b5dfa800 215487189 C Bi:1:003:1 0 86 = 20005000 4458b827 eb2db38e 0024d478 4f250800 4500003c 0daf4000 2b06a67f
b5dfa800 215487214 S Bi:1:003:1 -115 2560 <
b5dfab80 215665921 C Bi:1:003:1 0 72 = 20244200 6443ffff ffffffff 0024d478 4f250806 00010800 06040001 0024d478
b5dfab80 215665947 S Bi:1:003:1 -115 2560 <
b5dfa000 216374613 C Bi:1:003:1 0 114 = 20006c00 0458b827 eb2db38e e0b55fef 5fc90800 45480058 00004000 4006b883
b5dfa000 216374650 S Bi:1:003:1 -115 2560 <
